{
  "childName": "小橙",
  "childAge": 3,
  "reportYear": 2026,
  "parentName": "妈妈",
  "style": "warm",
  "photoCount": 12,
  "qaList": [
    { "question": "今年孩子最大的变化是什么？", "answer": "开始喜欢问问题了，每天问一百个为什么，变得更有主见了" },
    { "question": "今年最让你印象深刻的一件事是什么？", "answer": "第一次独立走完整段路去上幼儿园，没有哭" },
    { "question": "今年孩子学会了什么新能力？", "answer": "会自己穿鞋了，会骑平衡车，会用筷子夹菜" },
    { "question": "今年孩子说过哪句话让你印象很深？", "answer": "妈妈辛苦了，我长大了要保护你" },
    { "question": "今年孩子最喜欢什么？", "answer": "恐龙、画画、堆积木，还有睡前听故事" }
  ],
  "freeNote": "今年最难忘的是他生病那段时间，高烧三天，妈妈陪了三个夜晚。退烧那天早上他第一件事是找我要抱抱。那个瞬间我突然觉得再辛苦都值得。"
}
